STT,Mã CK▲,Tên công ty,Ngành,Sàn,Khối lượng NY/ĐKGD,link
1551,VNR,Tổng Công ty cổ phần Tái Bảo hiểm Quốc gia Việt Nam,Bảo hiểm và các hoạt động liên quan,HNX,150737130,https://finance.vietstock.vn/VNR-tong-cong-ty-co-phan-tai-bao-hiem-quoc-gia-viet-nam.htm
1552,VNS,CTCP Ánh Dương Việt Nam,Vận tải trung chuyển và vận tải hành khách bằng đường bộ,HOSE,67859192,https://finance.vietstock.vn/VNS-ctcp-anh-duong-viet-nam.htm
1553,VNT,CTCP Giao nhận Vận tải Ngoại thương,Hỗ trợ vận tải,HNX,11949005,https://finance.vietstock.vn/VNT-ctcp-giao-nhan-van-tai-ngoai-thuong.htm
1554,VNX,CTCP Quảng cáo và Hội chợ Thương mại,"Quảng cáo, quan hệ công chúng và dịch vụ liên quan",UPCoM,1224948,https://finance.vietstock.vn/VNX-ctcp-quang-cao-va-hoi-cho-thuong-mai.htm
1555,VNY,CTCP Thuốc thú y Trung ương I,"Sản xuất hóa chất, dược phẩm",UPCoM,14249969,https://finance.vietstock.vn/VNY-ctcp-thuoc-thu-y-trung-uong-i.htm
1556,VOC,Tổng Công ty Công Nghiệp Dầu Thực Vật Việt Nam - CTCP,Sản xuất thực phẩm,UPCoM,121800000,https://finance.vietstock.vn/VOC-tong-cong-ty-cong-nghiep-dau-thuc-vat-viet-nam-ctcp.htm
1557,VOS,CTCP Vận tải Biển Việt Nam,Vận tải đường thủy,HOSE,140000000,https://finance.vietstock.vn/VOS-ctcp-van-tai-bien-viet-nam.htm
1558,VPA,CTCP Vận tải Hoá Dầu VP,Vận tải đường thủy,UPCoM,15076177,https://finance.vietstock.vn/VPA-ctcp-van-tai-hoa-dau-vp.htm
1559,VPB,Ngân hàng TMCP Việt Nam Thịnh Vượng,Trung gian tín dụng và các hoạt động liên quan,HOSE,4505692987,https://finance.vietstock.vn/VPB-ngan-hang-tmcp-viet-nam-thinh-vuong.htm
1560,VPC,CTCP Đầu tư và Phát triển Năng lượng Việt Nam,Xây dựng công nghiệp nặng và dân dụng,UPCoM,5625000,https://finance.vietstock.vn/VPC-ctcp-dau-tu-va-phat-trien-nang-luong-viet-nam.htm
1561,VPD,CTCP Phát triển Điện lực Việt Nam,"Phát, truyền tải và phân phối điện năng",HOSE,106589629,https://finance.vietstock.vn/VPD-ctcp-phat-trien-dien-luc-viet-nam.htm
1562,VPG,CTCP Đầu tư Thương mại Xuất nhập khẩu Việt Phát,Bán buôn hàng lâu bền,HOSE,72907928,https://finance.vietstock.vn/VPG-ctcp-dau-tu-thuong-mai-xuat-nhap-khau-viet-phat.htm
1563,VPH,CTCP Vạn Phát Hưng,Phát triển bất động sản,HOSE,95357800,https://finance.vietstock.vn/VPH-ctcp-van-phat-hung.htm
1564,VPI,CTCP Đầu tư Văn Phú - INVEST,Phát triển bất động sản,HOSE,219999780,https://finance.vietstock.vn/VPI-ctcp-dau-tu-van-phu-invest.htm
1565,VPR,CTCP VinaPrint,In ấn và các hoạt động hỗ trợ,UPCoM,4575985,https://finance.vietstock.vn/VPR-ctcp-vinaprint.htm
1566,VPS,CTCP Thuốc sát trùng Việt Nam (VIPESCO),"Sản xuất hóa chất, dược phẩm",HOSE,24460792,https://finance.vietstock.vn/VPS-ctcp-thuoc-sat-trung-viet-nam-vipesco.htm
1567,VPW,CTCP Cấp thoát nước Số 1 Vĩnh Phúc,"Nước, chất thải và các hệ thống khác",UPCoM,11168676,https://finance.vietstock.vn/VPW-ctcp-cap-thoat-nuoc-so-1-vinh-phuc.htm
1568,VQC,CTCP Giám định - Vinacomin,Dịch vụ nghiên cứu và phát triển khoa học,UPCoM,3599580,https://finance.vietstock.vn/VQC-ctcp-giam-dinh-vinacomin.htm
1569,VRC,CTCP Bất động sản và Đầu tư VRC,Bất động sản,HOSE,50000000,https://finance.vietstock.vn/VRC-ctcp-bat-dong-san-va-dau-tu-vrc.htm
1570,VRE,CTCP Vincom Retail,Bất động sản,HOSE,2328818410,https://finance.vietstock.vn/VRE-ctcp-vincom-retail.htm
1571,VRG,CTCP Phát triển Đô thị và Khu công nghiệp Cao su Việt Nam,Bất động sản,UPCoM,25894868,https://finance.vietstock.vn/VRG-ctcp-phat-trien-do-thi-va-khu-cong-nghiep-cao-su-viet-nam.htm
1572,VSA,CTCP Đại lý Hàng hải Việt Nam,Hỗ trợ vận tải,HNX,14096486,https://finance.vietstock.vn/VSA-ctcp-dai-ly-hang-hai-viet-nam.htm
1573,VSC,CTCP Container Việt Nam,Hỗ trợ vận tải,HOSE,110245596,https://finance.vietstock.vn/VSC-ctcp-container-viet-nam.htm
1574,VSE,CTCP Dịch vụ Đường cao tốc Việt Nam,Xây dựng công nghiệp nặng và dân dụng,UPCoM,8937250,https://finance.vietstock.vn/VSE-ctcp-dich-vu-duong-cao-toc-viet-nam.htm
1575,VSF,Tổng Công ty Lương thực Miền Nam - CTCP,Sản xuất thực phẩm,UPCoM,500000000,https://finance.vietstock.vn/VSF-tong-cong-ty-luong-thuc-mien-nam-ctcp.htm
1576,VSG,CTCP Container Phía Nam,Vận tải đường thủy,UPCoM,11044000,https://finance.vietstock.vn/VSG-ctcp-container-phia-nam.htm
1577,VSH,CTCP Thủy điện Vĩnh Sơn - Sông Hinh,"Phát, truyền tải và phân phối điện năng",HOSE,236241246,https://finance.vietstock.vn/VSH-ctcp-thuy-dien-vinh-son-song-hinh.htm
1578,VSI,CTCP Đầu tư và Xây dựng Cấp thoát nước,Xây dựng công nghiệp nặng và dân dụng,HOSE,13200000,https://finance.vietstock.vn/VSI-ctcp-dau-tu-va-xay-dung-cap-thoat-nuoc.htm
1579,VSM,CTCP Container Miền Trung,Vận tải đường bộ,HNX,3050000,https://finance.vietstock.vn/VSM-ctcp-container-mien-trung.htm
1580,VSN,CTCP Việt Nam Kỹ nghệ Súc sản,Sản xuất thực phẩm,UPCoM,80914300,https://finance.vietstock.vn/VSN-ctcp-viet-nam-ky-nghe-suc-san.htm
1581,VSP,CTCP Vận tải biển và Bất động sản Việt Hải,Vận tải đường thủy,UPCoM,38084489,https://finance.vietstock.vn/VSP-ctcp-van-tai-bien-va-bat-dong-san-viet-hai.htm
1582,VST,CTCP Vận tải và Thuê tàu biển Việt Nam,Vận tải đường thủy,UPCoM,62999337,https://finance.vietstock.vn/VST-ctcp-van-tai-va-thue-tau-bien-viet-nam.htm
1583,VTA,CTCP Vitaly,Sản xuất sản phẩm khoáng chất phi kim,UPCoM,8000000,https://finance.vietstock.vn/VTA-ctcp-vitaly.htm
1584,VTB,CTCP Viettronics Tân Bình,"Sản xuất các sản phẩm điện tử, vi tính",HOSE,11982050,https://finance.vietstock.vn/VTB-ctcp-viettronics-tan-binh.htm
1585,VTC,CTCP Viễn thông VTC,Viễn thông,HNX,4534696,https://finance.vietstock.vn/VTC-ctcp-vien-thong-vtc.htm
1586,VTD,CTCP Du lịch Vietourist,Dịch vụ hành chính và hỗ trợ,UPCoM,6000000,https://finance.vietstock.vn/VTD-ctcp-du-lich-vietourist.htm
1587,VTE,CTCP VINACAP Kim Long,"Sản xuất các sản phẩm điện tử, vi tính",UPCoM,15600000,https://finance.vietstock.vn/VTE-ctcp-vinacap-kim-long.htm
1588,VTG,CTCP Du lịch Tỉnh Bà Rịa - Vũng Tàu,Khách sạn và phòng ở,UPCoM,18644500,https://finance.vietstock.vn/VTG-ctcp-du-lich-tinh-ba-ria-vung-tau.htm
1589,VTH,CTCP Dây cáp Điện Việt Thái,"Sản xuất trang thiết bị, dụng cụ điện",HNX,5000000,https://finance.vietstock.vn/VTH-ctcp-day-cap-dien-viet-thai.htm
1590,VTI,CTCP Sản xuất - Xuất nhập khẩu Dệt may,"Sản xuất sợi, vải",UPCoM,3500000,https://finance.vietstock.vn/VTI-ctcp-san-xuat-xuat-nhap-khau-det-may.htm
1591,VTJ,CTCP Thương mại và Đầu tư VI NA TA BA,Cửa hàng đồ nội thất và đồ dùng gia đình,HNX,11400000,https://finance.vietstock.vn/VTJ-ctcp-thuong-mai-va-dau-tu-vi-na-ta-ba.htm
1592,VTK,CTCP Tư vấn Thiết kế Viettel,"Kiến trúc, tư vấn xây dựng và dịch vụ liên quan",UPCoM,4783736,https://finance.vietstock.vn/VTK-ctcp-tu-van-thiet-ke-viettel.htm
1593,VTL,CTCP Vang Thăng Long,Sản xuất đồ uống và thuốc lá,HNX,5059992,https://finance.vietstock.vn/VTL-ctcp-vang-thang-long.htm
1594,VTM,CTCP Vận tải và Đưa đón thợ mỏ - VINACOMIN,Vận tải trung chuyển và vận tải hành khách bằng đường bộ,UPCoM,3279797,https://finance.vietstock.vn/VTM-ctcp-van-tai-va-dua-don-tho-mo-vinacomin.htm
1595,VTO,CTCP Vận tải Xăng dầu Vitaco,Vận tải đường thủy,HOSE,79866666,https://finance.vietstock.vn/VTO-ctcp-van-tai-xang-dau-vitaco.htm
1596,VTP,Tổng Công ty cổ phần Bưu chính Viettel,Hỗ trợ vận tải,UPCoM,103558492,https://finance.vietstock.vn/VTP-tong-cong-ty-co-phan-buu-chinh-viettel.htm
1597,VTQ,CTCP Việt Trung Quảng Bình,"Sản xuất hóa chất, dược phẩm",UPCoM,17081791,https://finance.vietstock.vn/VTQ-ctcp-viet-trung-quang-binh.htm
1598,VTR,CTCP Du lịch và Tiếp thị Giao thông Vận tải Việt Nam - Vietravel,Dịch vụ hành chính và hỗ trợ,UPCoM,17294833,https://finance.vietstock.vn/VTR-ctcp-du-lich-va-tiep-thi-giao-thong-van-tai-viet-nam-vietravel.htm
1599,VTS,CTCP Viglacera Từ Sơn,Sản xuất sản phẩm khoáng chất phi kim,UPCoM,2000205,https://finance.vietstock.vn/VTS-ctcp-viglacera-tu-son.htm
1600,VTV,CTCP Năng lượng và Môi trường VICEM,Bán buôn hàng lâu bền,HNX,31199825,https://finance.vietstock.vn/VTV-ctcp-nang-luong-va-moi-truong-vicem.htm
1601,VTX,CTCP Vận tải Đa Phương Thức Vietranstimex,Hỗ trợ vận tải,UPCoM,20972321,https://finance.vietstock.vn/VTX-ctcp-van-tai-da-phuong-thuc-vietranstimex.htm
1602,VTZ,CTCP Sản xuất và Thương mại Nhựa Việt Thành,Sản xuất các sản phẩm nhựa và cao su,HNX,20000000,https://finance.vietstock.vn/VTZ-ctcp-san-xuat-va-thuong-mai-nhua-viet-thanh.htm
1603,VUA,CTCP Chứng khoán Stanley Brothers,"Môi giới chứng khoán, hàng hóa, đầu tư tài chính khác và các hoạt động liên quan",UPCoM,33900000,https://finance.vietstock.vn/VUA-ctcp-chung-khoan-stanley-brothers.htm
1604,VVN,Tổng Công ty cổ phần Xây dựng Công nghiệp Việt Nam,Xây dựng công nghiệp nặng và dân dụng,UPCoM,55000000,https://finance.vietstock.vn/VVN-tong-cong-ty-co-phan-xay-dung-cong-nghiep-viet-nam.htm
1605,VW3,CTCP Viwaseen3,Xây dựng công nghiệp nặng và dân dụng,UPCoM,2000000,https://finance.vietstock.vn/VW3-ctcp-viwaseen3.htm
1606,VWS,CTCP Nước và Môi Trường Việt Nam,"Kiến trúc, tư vấn xây dựng và dịch vụ liên quan",UPCoM,3600000,https://finance.vietstock.vn/VWS-ctcp-nuoc-va-moi-truong-viet-nam.htm
1607,VXB,CTCP Vật liệu Xây dựng Bến Tre,"Xây dựng nhà cửa, cao ốc",HNX,4049006,https://finance.vietstock.vn/VXB-ctcp-vat-lieu-xay-dung-ben-tre.htm
1608,VXP,CTCP Thuốc Thú y Trung ương VETVACO,"Sản xuất hóa chất, dược phẩm",UPCoM,3600000,https://finance.vietstock.vn/VXP-ctcp-thuoc-thu-y-trung-uong-vetvaco.htm
1609,VXT,CTCP Kho vận và Dịch vụ Thương mại,Bán buôn hàng tiêu dùng,UPCoM,3600000,https://finance.vietstock.vn/VXT-ctcp-kho-van-va-dich-vu-thuong-mai.htm
1610,WCS,CTCP Bến xe Miền Tây,Hỗ trợ vận tải,HNX,2500000,https://finance.vietstock.vn/WCS-ctcp-ben-xe-mien-tay.htm
1611,WSB,CTCP Bia Sài Gòn - Miền Tây,Sản xuất đồ uống và thuốc lá,UPCoM,14500000,https://finance.vietstock.vn/WSB-ctcp-bia-sai-gon-mien-tay.htm
1612,WSS,CTCP Chứng khoán Phố Wall,"Môi giới chứng khoán, hàng hóa, đầu tư tài chính khác và các hoạt động liên quan",HNX,50300000,https://finance.vietstock.vn/WSS-ctcp-chung-khoan-pho-wall.htm
1613,WTC,CTCP Vận tải Thủy - Vinacomin,Vận tải đường thủy,UPCoM,10000000,https://finance.vietstock.vn/WTC-ctcp-van-tai-thuy-vinacomin.htm
1614,X20,CTCP X20,Sản xuất các sản phẩm may mặc,HNX,17250000,https://finance.vietstock.vn/X20-ctcp-x20.htm
1615,X26,CTCP 26,Sản xuất các sản phẩm may mặc,UPCoM,5000000,https://finance.vietstock.vn/X26-ctcp-26.htm
1616,X77,CTCP Thành An 77,Sản xuất sản phẩm khoáng chất phi kim,UPCoM,1340877,https://finance.vietstock.vn/X77-ctcp-thanh-an-77.htm
1617,XDH,CTCP Đầu tư Xây dựng Dân dụng Hà Nội,Phát triển bất động sản,UPCoM,16380000,https://finance.vietstock.vn/XDH-ctcp-dau-tu-xay-dung-dan-dung-ha-noi.htm
1618,XHC,CTCP Xuân Hòa Việt Nam,Sản xuất các sản phẩm gỗ,UPCoM,21096500,https://finance.vietstock.vn/XHC-ctcp-xuan-hoa-viet-nam.htm
1619,XLV,CTCP Xây Lắp và Dịch vụ Sông Đà,Xây dựng công nghiệp nặng và dân dụng,UPCoM,3000000,https://finance.vietstock.vn/XLV-ctcp-xay-lap-va-dich-vu-song-da.htm
1620,XMC,CTCP Đầu tư và Xây dựng Xuân Mai,Bất động sản,UPCoM,67364339,https://finance.vietstock.vn/XMC-ctcp-dau-tu-va-xay-dung-xuan-mai.htm
1621,XMD,CTCP Xuân Mai - Đạo Tú,Sản xuất sản phẩm khoáng chất phi kim,UPCoM,4000000,https://finance.vietstock.vn/XMD-ctcp-xuan-mai-dao-tu.htm
1622,XMP,CTCP Thủy điện Xuân Minh,"Phát, truyền tải và phân phối điện năng",UPCoM,15000000,https://finance.vietstock.vn/XMP-ctcp-thuy-dien-xuan-minh.htm
1623,XPH,CTCP Xà phòng Hà Nội,"Sản xuất hóa chất, dược phẩm",UPCoM,12972475,https://finance.vietstock.vn/XPH-ctcp-xa-phong-ha-noi.htm
1624,YBC,CTCP Xi măng và Khoáng sản Yên Bái,Sản xuất sản phẩm khoáng chất phi kim,UPCoM,11800000,https://finance.vietstock.vn/YBC-ctcp-xi-mang-va-khoang-san-yen-bai.htm
1625,YBM,CTCP Khoáng sản Công nghiệp Yên Bái,Sản xuất sản phẩm khoáng chất phi kim,HOSE,14299880,https://finance.vietstock.vn/YBM-ctcp-khoang-san-cong-nghiep-yen-bai.htm
1626,YEG,CTCP Tập đoàn Yeah1,"Quảng cáo, quan hệ công chúng và dịch vụ liên quan",HOSE,31279968,https://finance.vietstock.vn/YEG-ctcp-tap-doan-yeah1.htm
1627,YTC,CTCP Xuất nhập khẩu Y tế Thành phố Hồ Chí Minh,Bán buôn hàng tiêu dùng,UPCoM,3080000,https://finance.vietstock.vn/YTC-ctcp-xuat-nhap-khau-y-te-thanh-pho-ho-chi-minh.htm
1628,126IBC,CTCP Đầu tư Kinh doanh và Xây dựng 126,"Xây dựng nhà cửa, cao ốc",OTC,0,https://finance.vietstock.vn/126IBC-ctcp-dau-tu-kinh-doanh-va-xay-dung-126.htm
1629,3TAudit,Công ty TNHH Dịch vụ Tài chính - Kế toán và Kiểm toán 3T,Dịch vụ pháp lý,Khác,0,https://finance.vietstock.vn/3TAudit-cong-ty-tnhh-dich-vu-tai-chinh-ke-toan-va-kiem-toan-3t.htm
1630,AA,Công ty TNHH Kiểm toán Mỹ,Dịch vụ pháp lý,Khác,0,https://finance.vietstock.vn/AA-cong-ty-tnhh-kiem-toan-my.htm
1631,AAAA,CTCP Bảo hiểm AAA,Bảo hiểm và các hoạt động liên quan,OTC,0,https://finance.vietstock.vn/AAAA-ctcp-bao-hiem-aaa.htm
1632,AAAT,"Công ty TNHH Dịch vụ Kiểm toán, Kế toán và Tư vấn Thuế AAT",Dịch vụ pháp lý,Khác,0,https://finance.vietstock.vn/AAAT-cong-ty-tnhh-dich-vu-kiem-toan-ke-toan-va-tu-van-thue-aat.htm
1633,AAC,Công ty TNHH Kiểm toán và Kế toán AAC,Dịch vụ pháp lý,Khác,0,https://finance.vietstock.vn/AAC-cong-ty-tnhh-kiem-toan-va-ke-toan-aac.htm
1634,AACA,Công ty TNHH Tư vấn và Kiểm toán Á Châu,Dịch vụ pháp lý,Khác,0,https://finance.vietstock.vn/AACA-cong-ty-tnhh-tu-van-va-kiem-toan-a-chau.htm
1635,AACC,Công ty TNHH Kế toán Kiểm toán Tư vấn Việt Nam,Dịch vụ pháp lý,Khác,0,https://finance.vietstock.vn/AACC-cong-ty-tnhh-ke-toan-kiem-toan-tu-van-viet-nam.htm
1636,AACVN,Công ty TNHH Kiểm toán - Tư vấn Định giá ACC Việt Nam,Dịch vụ pháp lý,Khác,0,https://finance.vietstock.vn/AACVN-cong-ty-tnhh-kiem-toan-tu-van-dinh-gia-acc-viet-nam.htm
1637,AAFC,Công ty TNHH Tư vấn Tài chính Kế toán và Kiểm toán Việt Nam,Dịch vụ pháp lý,Khác,0,https://finance.vietstock.vn/AAFC-cong-ty-tnhh-tu-van-tai-chinh-ke-toan-va-kiem-toan-viet-nam.htm
1638,AASC,Công ty TNHH Hãng Kiểm toán AASC,Dịch vụ pháp lý,Khác,0,https://finance.vietstock.vn/AASC-cong-ty-tnhh-hang-kiem-toan-aasc.htm
1639,AASCN,Công ty TNHH Dịch vụ Tư vấn Tài chính Kinh tế và Kiểm toán Nam Việt,Dịch vụ pháp lý,Khác,0,https://finance.vietstock.vn/AASCN-cong-ty-tnhh-dich-vu-tu-van-tai-chinh-kinh-te-va-kiem-toan-nam-viet.htm
1640,AASCS,Công ty TNHH Dịch vụ Tư vấn Tài chính Kế toán và Kiểm toán Phía Nam,Dịch vụ pháp lý,Khác,0,https://finance.vietstock.vn/AASCS-cong-ty-tnhh-dich-vu-tu-van-tai-chinh-ke-toan-va-kiem-toan-phia-nam.htm
1641,AAUS,CTCP Chứng khoán Á - Âu,"Môi giới chứng khoán, hàng hóa, đầu tư tài chính khác và các hoạt động liên quan",OTC,3500000,https://finance.vietstock.vn/AAUS-ctcp-chung-khoan-a-au.htm
1642,ABBS,CTCP Chứng khoán An Bình,"Môi giới chứng khoán, hàng hóa, đầu tư tài chính khác và các hoạt động liên quan",OTC,39700000,https://finance.vietstock.vn/ABBS-ctcp-chung-khoan-an-binh.htm
1643,ABBVietNam,Công ty TNHH Kiểm toán A.B.B Việt Nam,Dịch vụ pháp lý,Khác,0,https://finance.vietstock.vn/ABBVietNam-cong-ty-tnhh-kiem-toan-a-b-b-viet-nam.htm
1644,ABFM,CTCP Quản lý Quỹ đầu tư Chứng khoán An Bình,"Quỹ, Quỹ tín thác và các công cụ tài chính khác",OTC,0,https://finance.vietstock.vn/ABFM-ctcp-quan-ly-quy-dau-tu-chung-khoan-an-binh.htm
1645,AC4,CTCP ACC-244,Xây dựng công nghiệp nặng và dân dụng,OTC,2940862,https://finance.vietstock.vn/AC4-ctcp-acc-244.htm
1646,ACAGroup,Công ty TNHH Kiểm toán và Tư vấn Tài chính,Dịch vụ pháp lý,Khác,0,https://finance.vietstock.vn/ACAGroup-cong-ty-tnhh-kiem-toan-va-tu-van-tai-chinh.htm
1647,ACBC,Công ty TNHH MTV Quản lý Quỹ ACB,"Quỹ, Quỹ tín thác và các công cụ tài chính khác",Khác,0,https://finance.vietstock.vn/ACBC-cong-ty-tnhh-mtv-quan-ly-quy-acb.htm
1648,ACBS,Công ty TNHH Chứng khoán ACB,"Môi giới chứng khoán, hàng hóa, đầu tư tài chính khác và các hoạt động liên quan",Khác,150000000,https://finance.vietstock.vn/ACBS-cong-ty-tnhh-chung-khoan-acb.htm
1649,ACCCO,CTCP Tư vấn Kiến trúc và Xây dựng Thành phố Hồ Chí Minh,"Xây dựng nhà cửa, cao ốc",OTC,0,https://finance.vietstock.vn/ACCCO-ctcp-tu-van-kien-truc-va-xay-dung-thanh-pho-ho-chi-minh.htm
1650,ACELife,Công ty TNHH Bảo hiểm Nhân thọ ACE,Bảo hiểm và các hoạt động liên quan,Khác,0,https://finance.vietstock.vn/ACELife-cong-ty-tnhh-bao-hiem-nhan-tho-ace.htm
1651,ACELifeFMC,Công ty TNHH MTV Quản lý Quỹ ACE LIFE,"Quỹ, Quỹ tín thác và các công cụ tài chính khác",Khác,0,https://finance.vietstock.vn/ACELifeFMC-cong-ty-tnhh-mtv-quan-ly-quy-ace-life.htm
1652,ACGroup,Công ty TNHH Tư vấn và Kiểm toán Quốc tế,Dịch vụ pháp lý,Khác,0,https://finance.vietstock.vn/ACGroup-cong-ty-tnhh-tu-van-va-kiem-toan-quoc-te.htm
1653,ACHAU,CTCP Tơ tằm Á Châu,"Sản xuất sợi, vải",OTC,5000000,https://finance.vietstock.vn/ACHAU-ctcp-to-tam-a-chau.htm
1654,AChauAudit,Công ty TNHH Kiểm toán Quốc tế Á Châu,Dịch vụ pháp lý,Khác,0,https://finance.vietstock.vn/AChauAudit-cong-ty-tnhh-kiem-toan-quoc-te-a-chau.htm
1655,Aclii,CTCP Cho thuê Tài chính II Ngân hàng Nông nghiệp và Phát triển Nông thôn Việt Nam,Thuê và cho thuê xe hơi,OTC,0,https://finance.vietstock.vn/Aclii-ctcp-cho-thue-tai-chinh-ii-ngan-hang-nong-nghiep-va-phat-trien-nong-thon-viet-nam.htm
1656,ACPA,Công ty TNHH Kiểm toán và Tư vấn Nexia ACPA,Dịch vụ pháp lý,Khác,0,https://finance.vietstock.vn/ACPA-cong-ty-tnhh-kiem-toan-va-tu-van-nexia-acpa.htm
1657,ACSVN,CTCP ACS Việt Nam,"Nghệ thuật, vui chơi và giải trí",OTC,10800000,https://finance.vietstock.vn/ACSVN-ctcp-acs-viet-nam.htm
1658,ACVietNam,Công ty TNHH Tài chính và Kiểm toán Việt Nam,Dịch vụ pháp lý,Khác,0,https://finance.vietstock.vn/ACVietNam-cong-ty-tnhh-tai-chinh-va-kiem-toan-viet-nam.htm
1659,AEAAudit,Công ty TNHH Kiểm toán Đông Á,Dịch vụ pháp lý,Khác,0,https://finance.vietstock.vn/AEAAudit-cong-ty-tnhh-kiem-toan-dong-a.htm
1660,AECS,CTCP Tư vấn Xây dựng và Dịch vụ Hàng Không,"Xây dựng nhà cửa, cao ốc",OTC,0,https://finance.vietstock.vn/AECS-ctcp-tu-van-xay-dung-va-dich-vu-hang-khong.htm
1661,AFC,CTCP Nông Lâm nghiệp Bình Dương,Hoạt động hỗ trợ cho nông lâm nghiệp,OTC,10688363,https://finance.vietstock.vn/AFC-ctcp-nong-lam-nghiep-binh-duong.htm
1662,AFCAudit,Công ty TNHH Kiểm toán AFC Việt Nam,Dịch vụ pháp lý,Khác,0,https://finance.vietstock.vn/AFCAudit-cong-ty-tnhh-kiem-toan-afc-viet-nam.htm
1663,AFCC,Công ty TNHH Kiểm toán và Tư vấn Tài chính A.F.C.C,Dịch vụ pháp lý,Khác,0,https://finance.vietstock.vn/AFCC-cong-ty-tnhh-kiem-toan-va-tu-van-tai-chinh-a-f-c-c.htm
1664,AFCVietNam,Công ty TNHH Kiểm toán và Tư vấn Tài chính Kế toán Việt Nam,Dịch vụ pháp lý,Khác,0,https://finance.vietstock.vn/AFCVietNam-cong-ty-tnhh-kiem-toan-va-tu-van-tai-chinh-ke-toan-viet-nam.htm
1665,AFCVietnamFund,Quỹ AFC Vietnam Fund,"Quỹ, Quỹ tín thác và các công cụ tài chính khác",Khác,0,https://finance.vietstock.vn/AFCVietnamFund-quy-afc-vietnam-fund.htm
1666,AFPAudit,Công ty TNHH Kiểm toán và Tư vấn AFP,Dịch vụ pháp lý,Khác,0,https://finance.vietstock.vn/AFPAudit-cong-ty-tnhh-kiem-toan-va-tu-van-afp.htm
1667,AFVI,Công ty TNHH Kiểm toán Tư vấn Tài chính và Đầu tư Việt Nam,Dịch vụ pháp lý,Khác,0,https://finance.vietstock.vn/AFVI-cong-ty-tnhh-kiem-toan-tu-van-tai-chinh-va-dau-tu-viet-nam.htm
1668,AGC,CTCP Cà phê An Giang,Sản xuất thực phẩm,OTC,8300000,https://finance.vietstock.vn/AGC-ctcp-ca-phe-an-giang.htm
1669,AGD,CTCP Gò Đàng,Sản xuất thực phẩm,OTC,11999930,https://finance.vietstock.vn/AGD-ctcp-go-dang.htm
1670,Agribank,Ngân hàng Nông nghiệp và Phát triển Nông thôn Việt Nam,Trung gian tín dụng và các hoạt động liên quan,Khác,0,https://finance.vietstock.vn/Agribank-ngan-hang-nong-nghiep-va-phat-trien-nong-thon-viet-nam.htm
1671,AGRIMECO,Tổng Công ty Cơ điện Xây dựng - CTCP,Xây dựng công nghiệp nặng và dân dụng,OTC,0,https://finance.vietstock.vn/AGRIMECO-tong-cong-ty-co-dien-xay-dung-ctcp.htm
1672,AgrimexcoCaMau,CTCP Xuất nhập khẩu Nông sản Thực phẩm Cà Mau,Bán buôn hàng tiêu dùng,OTC,5000000,https://finance.vietstock.vn/AgrimexcoCaMau-ctcp-xuat-nhap-khau-nong-san-thuc-pham-ca-mau.htm
1673,AGRITOUR,CTCP Du lịch Thương mại Nông nghiệp Việt Nam,Chăn nuôi,OTC,0,https://finance.vietstock.vn/AGRITOUR-ctcp-du-lich-thuong-mai-nong-nghiep-viet-nam.htm
1674,AGROMAS,CTCP Cơ điện Nông Nghiệp và Thủy Lợi II,Sản xuất sản phẩm khoáng chất phi kim,OTC,0,https://finance.vietstock.vn/AGROMAS-ctcp-co-dien-nong-nghiep-va-thuy-loi-ii.htm
1675,AGTourimex,CTCP Du lịch An Giang,Dịch vụ hành chính và hỗ trợ,OTC,0,https://finance.vietstock.vn/AGTourimex-ctcp-du-lich-an-giang.htm
1676,AIA,Công ty TNHH Bảo hiểm Nhân thọ AIA (Việt Nam),Bảo hiểm và các hoạt động liên quan,Khác,0,https://finance.vietstock.vn/AIA-cong-ty-tnhh-bao-hiem-nhan-tho-aia-viet-nam.htm
1677,AICA,Công ty TNHH Tư vấn - Kiểm toán Liên Minh Quốc tế,Dịch vụ pháp lý,Khác,0,https://finance.vietstock.vn/AICA-cong-ty-tnhh-tu-van-kiem-toan-lien-minh-quoc-te.htm
1678,AICapital,Công ty Quản lý Quỹ đầu tư A.I Capital,"Quỹ, Quỹ tín thác và các công cụ tài chính khác",Khác,0,https://finance.vietstock.vn/AICapital-cong-ty-quan-ly-quy-dau-tu-a-i-capital.htm
1679,Airserco,CTCP Cung ứng Dịch vụ Hàng Không,Vận tải hàng không,OTC,2800000,https://finance.vietstock.vn/Airserco-ctcp-cung-ung-dich-vu-hang-khong.htm
1680,AISC,Công ty TNHH Kiểm toán và Dịch vụ Tin học,Dịch vụ pháp lý,Khác,0,https://finance.vietstock.vn/AISC-cong-ty-tnhh-kiem-toan-va-dich-vu-tin-hoc.htm
1681,AITS,CTCP Tin học Viễn thông Hàng không,Viễn thông,OTC,0,https://finance.vietstock.vn/AITS-ctcp-tin-hoc-vien-thong-hang-khong.htm
1682,ALC,CTCP Âu Lạc,Vận tải đường thủy,OTC,2890000,https://finance.vietstock.vn/ALC-ctcp-au-lac.htm
1683,ALP,CTCP Đầu tư Alphanam,"Sản xuất trang thiết bị, dụng cụ điện",OTC,192484413,https://finance.vietstock.vn/ALP-ctcp-dau-tu-alphanam.htm
1684,ALS,CTCP Logistics Hàng không,Vận tải hàng không,OTC,0,https://finance.vietstock.vn/ALS-ctcp-logistics-hang-khong.htm
1685,AMIC,CTCP Đầu tư AMIC,Chăn nuôi,OTC,12000000,https://finance.vietstock.vn/AMIC-ctcp-dau-tu-amic.htm
1686,ANCO,CTCP Dinh dưỡng Nông nghiệp Quốc tế,Chăn nuôi,OTC,0,https://finance.vietstock.vn/ANCO-ctcp-dinh-duong-nong-nghiep-quoc-te.htm
1687,AnGiangDT,Công ty TNHH MTV Môi trường Đô thị An Giang,Chăn nuôi,Khác,0,https://finance.vietstock.vn/AnGiangDT-cong-ty-tnhh-mtv-moi-truong-do-thi-an-giang.htm
1688,AnPhatAudit,Công ty TNHH Kiểm toán và Kế toán An Phát,Dịch vụ pháp lý,Khác,0,https://finance.vietstock.vn/AnPhatAudit-cong-ty-tnhh-kiem-toan-va-ke-toan-an-phat.htm
1689,AnphatCapital,CTCP Quản lý Quỹ Đầu tư Merlin,"Quỹ, Quỹ tín thác và các công cụ tài chính khác",OTC,2500000,https://finance.vietstock.vn/AnphatCapital-ctcp-quan-ly-quy-dau-tu-merlin.htm
1690,AnPhu,CTCP An Phú,Bất động sản,OTC,0,https://finance.vietstock.vn/AnPhu-ctcp-an-phu.htm
1691,AnPhuCorp,CTCP Đầu tư Bất động sản An Phú,"Xây dựng nhà cửa, cao ốc",OTC,0,https://finance.vietstock.vn/AnPhuCorp-ctcp-dau-tu-bat-dong-san-an-phu.htm
1692,AnPhuGroup,Công ty TNHH Kiểm toán An Phú,Dịch vụ pháp lý,Khác,0,https://finance.vietstock.vn/AnPhuGroup-cong-ty-tnhh-kiem-toan-an-phu.htm
1693,Anresco,CTCP Địa ốc An Giang,"Xây dựng nhà cửa, cao ốc",OTC,0,https://finance.vietstock.vn/Anresco-ctcp-dia-oc-an-giang.htm
1694,ANZB,Ngân hàng TNHH MTV ANZ Việt Nam,Trung gian tín dụng và các hoạt động liên quan,Khác,0,https://finance.vietstock.vn/ANZB-ngan-hang-tnhh-mtv-anz-viet-nam.htm
1695,AON,Công ty TNHH AON Việt Nam,Bảo hiểm và các hoạt động liên quan,Khác,0,https://finance.vietstock.vn/AON-cong-ty-tnhh-aon-viet-nam.htm
1696,APBAudit,Công ty TNHH Kiểm toán và Kế toán A.P.B,Dịch vụ pháp lý,Khác,0,https://finance.vietstock.vn/APBAudit-cong-ty-tnhh-kiem-toan-va-ke-toan-a-p-b.htm
1697,ApecAudit,Công ty TNHH Kiểm toán APEC,Dịch vụ pháp lý,Khác,0,https://finance.vietstock.vn/ApecAudit-cong-ty-tnhh-kiem-toan-apec.htm
