STT,Mã CK▲,Tên công ty,Ngành,Sàn,Khối lượng NY/ĐKGD,link
2439,ManulifeAM,Công ty TNHH Quản lý Quỹ Manulife Việt Nam,"Quỹ, Quỹ tín thác và các công cụ tài chính khác",Khác,0,https://finance.vietstock.vn/ManulifeAM-cong-ty-tnhh-quan-ly-quy-manulife-viet-nam.htm
2440,MAX,CTCP Khai khoáng và Cơ khí Hữu Nghị Vĩnh Sinh,Sản xuất sản phẩm khoáng chất phi kim,OTC,7200000,https://finance.vietstock.vn/MAX-ctcp-khai-khoang-va-co-khi-huu-nghi-vinh-sinh.htm
2441,MayDongA,CTCP Dệt may Đông Á,"Sản xuất sợi, vải",OTC,3650000,https://finance.vietstock.vn/MayDongA-ctcp-det-may-dong-a.htm
2442,MayLongAn,CTCP Cơ khí và Chế tạo Máy Long An,Sản xuất trang thiết bị nội thất và sản phẩm liên quan,OTC,0,https://finance.vietstock.vn/MayLongAn-ctcp-co-khi-va-che-tao-may-long-an.htm
2443,MayPhuongDong,CTCP May Phương Đông,"Sản xuất sợi, vải",OTC,0,https://finance.vietstock.vn/MayPhuongDong-ctcp-may-phuong-dong.htm
2444,MaySaiGon2,CTCP May Sài Gòn 2,"Sản xuất sợi, vải",OTC,0,https://finance.vietstock.vn/MaySaiGon2-ctcp-may-sai-gon-2.htm
2445,MaySaiGon3,CTCP May Sài Gòn 3,"Sản xuất sợi, vải",OTC,0,https://finance.vietstock.vn/MaySaiGon3-ctcp-may-sai-gon-3.htm
2446,MayThangLong,CTCP May Thăng Long,"Sản xuất sợi, vải",OTC,2330670,https://finance.vietstock.vn/MayThangLong-ctcp-may-thang-long.htm
2447,MayVietThang,CTCP May Việt Thắng,"Sản xuất sợi, vải",OTC,1600000,https://finance.vietstock.vn/MayVietThang-ctcp-may-viet-thang.htm
2448,MayVietThinh,CTCP May Việt Thịnh,"Sản xuất sợi, vải",OTC,26000000,https://finance.vietstock.vn/MayVietThinh-ctcp-may-viet-thinh.htm
2449,Mazars,Công ty TNHH Mazars Việt Nam,Dịch vụ pháp lý,Khác,0,https://finance.vietstock.vn/Mazars-cong-ty-tnhh-mazars-viet-nam.htm
2450,MBCapital,CTCP Quản lý Quỹ đầu tư MB,"Quỹ, Quỹ tín thác và các công cụ tài chính khác",OTC,0,https://finance.vietstock.vn/MBCapital-ctcp-quan-ly-quy-dau-tu-mb.htm
2451,MBEF1,Quỹ đầu tư Cổ phần MB Capital 1,"Quỹ, Quỹ tín thác và các công cụ tài chính khác",Khác,0,https://finance.vietstock.vn/MBEF1-quy-dau-tu-co-phan-mb-capital-1.htm
2452,MBKE,Công ty TNHH MTV Chứng khoán Maybank Kim Eng,"Môi giới chứng khoán, hàng hóa, đầu tư tài chính khác và các hoạt động liên quan",Khác,20000000,https://finance.vietstock.vn/MBKE-cong-ty-tnhh-mtv-chung-khoan-maybank-kim-eng.htm
2453,MBVF,Quỹ đầu tư Giá trị MB Capital,"Môi giới chứng khoán, hàng hóa, đầu tư tài chính khác và các hoạt động liên quan",OTC,0,https://finance.vietstock.vn/MBVF-quy-dau-tu-gia-tri-mb-capital.htm
2454,Mccons,CTCP Thi công Cơ giới và Dịch vụ,"Xây dựng nhà cửa, cao ốc",OTC,3510000,https://finance.vietstock.vn/Mccons-ctcp-thi-cong-co-gioi-va-dich-vu.htm
2455,MCJ,CTCP Thiết bị Phụ tùng,Bán buôn hàng tiêu dùng,OTC,5000000,https://finance.vietstock.vn/MCJ-ctcp-thiet-bi-phu-tung.htm
2456,MCL,CTCP Phát triển Nhà và Sản xuất Vật liệu Xây dựng Chí Linh,Sản xuất sản phẩm khoáng chất phi kim,OTC,2220000,https://finance.vietstock.vn/MCL-ctcp-phat-trien-nha-va-san-xuat-vat-lieu-xay-dung-chi-linh.htm
2457,MCS,CTCP Thi công Cơ giới Xây lắp,"Xây dựng nhà cửa, cao ốc",OTC,3500000,https://finance.vietstock.vn/MCS-ctcp-thi-cong-co-gioi-xay-lap.htm
2458,MCT,CTCP Kinh doanh Vật Tư và Xây dựng,Sản xuất sản phẩm khoáng chất phi kim,OTC,2500000,https://finance.vietstock.vn/MCT-ctcp-kinh-doanh-vat-tu-va-xay-dung.htm
2459,MCV,CTCP Cavico Việt Nam Khai thác mỏ và Xây dựng,Xây dựng công nghiệp nặng và dân dụng,OTC,12092161,https://finance.vietstock.vn/MCV-ctcp-cavico-viet-nam-khai-thac-mo-va-xay-dung.htm
2460,MDB,Ngân hàng TMCP Phát triển Mê Kông,Trung gian tín dụng và các hoạt động liên quan,Khác,375000000,https://finance.vietstock.vn/MDB-ngan-hang-tmcp-phat-trien-me-kong.htm
2461,MDFVINAFOR,Công ty TNHH MDF Vinafor – Tân An Hòa Bình,Sản xuất các sản phẩm gỗ,Khác,0,https://finance.vietstock.vn/MDFVINAFOR-cong-ty-tnhh-mdf-vinafor-–-tan-an-hoa-binh.htm
2462,MDN,CTCP Tổng Công ty May Đồng Nai,Sản xuất các sản phẩm may mặc,OTC,10935584,https://finance.vietstock.vn/MDN-ctcp-tong-cong-ty-may-dong-nai.htm
2463,MDT,CTCP Cơ khí mỏ và Đóng tàu - TKV,Sản xuất phương tiện vận tải,OTC,1510000,https://finance.vietstock.vn/MDT-ctcp-co-khi-mo-va-dong-tau-tkv.htm
2464,MEBI,CTCP Dược phẩm và Sinh học Y tế,Sản xuất khác,OTC,0,https://finance.vietstock.vn/MEBI-ctcp-duoc-pham-va-sinh-hoc-y-te.htm
2465,MECO,CTCP Cơ điện Luyện kim Thái Nguyên,Sản xuất sản phẩm khoáng chất phi kim,OTC,0,https://finance.vietstock.vn/MECO-ctcp-co-dien-luyen-kim-thai-nguyen.htm
2466,Medico,CTCP Phát triển khoáng Sản,Sản xuất sản phẩm khoáng chất phi kim,OTC,0,https://finance.vietstock.vn/Medico-ctcp-phat-trien-khoang-san.htm
2467,Mediplast,CTCP Nhựa Y tế Mediplast,Sản xuất khác,OTC,0,https://finance.vietstock.vn/Mediplast-ctcp-nhua-y-te-mediplast.htm
2468,MekongCapital,Công ty TNHH Tư vấn Mekong Capital,"Quỹ, Quỹ tín thác và các công cụ tài chính khác",Khác,0,https://finance.vietstock.vn/MekongCapital-cong-ty-tnhh-tu-van-mekong-capital.htm
2469,MEKONIMEX,CTCP Nông sản Thực phẩm Xuất khẩu Cần Thơ,Chăn nuôi,OTC,0,https://finance.vietstock.vn/MEKONIMEX-ctcp-nong-san-thuc-pham-xuat-khau-can-tho.htm
2470,MHAuditing,Công ty TNHH Kiểm toán M&H,Dịch vụ pháp lý,Khác,0,https://finance.vietstock.vn/MHAuditing-cong-ty-tnhh-kiem-toan-mh.htm
2471,MHB,Ngân hàng TMCP Phát triển Nhà Đồng bằng sông Cửu Long,Trung gian tín dụng và các hoạt động liên quan,Khác,306215200,https://finance.vietstock.vn/MHB-ngan-hang-tmcp-phat-trien-nha-dong-bang-song-cuu-long.htm
2472,MHBS,CTCP Chứng khoán MHB,"Môi giới chứng khoán, hàng hóa, đầu tư tài chính khác và các hoạt động liên quan",OTC,14000000,https://finance.vietstock.vn/MHBS-ctcp-chung-khoan-mhb.htm
2473,MHDAudit,Công ty TNHH Kiểm toán MHD,Dịch vụ pháp lý,Khác,0,https://finance.vietstock.vn/MHDAudit-cong-ty-tnhh-kiem-toan-mhd.htm
2474,MHP,CTCP Môi trường và Dịch vụ Đô thị Việt Trì,Dịch vụ quản lý và tái chế chất thải,OTC,3583140,https://finance.vietstock.vn/MHP-ctcp-moi-truong-va-dich-vu-do-thi-viet-tri.htm
2475,MHY,CTCP Môi trường và Công trình Đô thị Hưng Yên,"Kiến trúc, tư vấn xây dựng và dịch vụ liên quan",OTC,31800,https://finance.vietstock.vn/MHY-ctcp-moi-truong-va-cong-trinh-do-thi-hung-yen.htm
2476,MiaDuongBenTre,CTCP Mía đường Bến Tre,Sản xuất thực phẩm,OTC,0,https://finance.vietstock.vn/MiaDuongBenTre-ctcp-mia-duong-ben-tre.htm
2477,MiaDuongNongCong,CTCP Mía Đường Nông Cống,Sản xuất thực phẩm,OTC,0,https://finance.vietstock.vn/MiaDuongNongCong-ctcp-mia-duong-nong-cong.htm
2478,MiaDuongSonDuong,CTCP Mía đường Sơn Dương,Sản xuất thực phẩm,OTC,0,https://finance.vietstock.vn/MiaDuongSonDuong-ctcp-mia-duong-son-duong.htm
2479,MienTrung,CTCP Đầu tư và Phát triển Miền Trung,Vận tải đường bộ,OTC,0,https://finance.vietstock.vn/MienTrung-ctcp-dau-tu-va-phat-trien-mien-trung.htm
2480,MIH,CTCP Xuất nhập khẩu Khoáng sản Hà Nam,Sản xuất các sản phẩm nhựa và cao su,OTC,4000000,https://finance.vietstock.vn/MIH-ctcp-xuat-nhap-khau-khoang-san-ha-nam.htm
2481,MINEXCO,CTCP Khoáng sản và Đầu tư Khánh Hòa,Khai khoáng (ngoại trừ dầu mỏ và khí đốt),OTC,0,https://finance.vietstock.vn/MINEXCO-ctcp-khoang-san-va-dau-tu-khanh-hoa.htm
2482,MinhPhuc,CTCP Sản xuất và Thương mại Minh Phúc,Sản xuất giấy,OTC,4757770,https://finance.vietstock.vn/MinhPhuc-ctcp-san-xuat-va-thuong-mai-minh-phuc.htm
2483,MinhVietCapital,CTCP Quản lý Quỹ PAVO CAPITAL,"Quỹ, Quỹ tín thác và các công cụ tài chính khác",OTC,0,https://finance.vietstock.vn/MinhVietCapital-ctcp-quan-ly-quy-pavo-capital.htm
2484,MiraeAsset,Công ty TNHH Chứng khoán Mirae Asset (Việt Nam),"Môi giới chứng khoán, hàng hóa, đầu tư tài chính khác và các hoạt động liên quan",Khác,0,https://finance.vietstock.vn/MiraeAsset-cong-ty-tnhh-chung-khoan-mirae-asset-viet-nam.htm
2485,MIREX,CTCP Khoáng sản và Luyện kim Việt Nam,Sản xuất sản phẩm khoáng chất phi kim,OTC,0,https://finance.vietstock.vn/MIREX-ctcp-khoang-san-va-luyen-kim-viet-nam.htm
2486,MIWACO,CTCP Nước khoáng và Du Lịch Sơn Kim,Sản xuất thực phẩm,OTC,0,https://finance.vietstock.vn/MIWACO-ctcp-nuoc-khoang-va-du-lich-son-kim.htm
2487,MJC,CTCP Thương mại Mộc Hóa,Cửa hàng đồ nội thất và đồ dùng gia đình,OTC,1596620,https://finance.vietstock.vn/MJC-ctcp-thuong-mai-moc-hoa.htm
2488,MKT,CTCP Dệt Minh Khai,Sản xuất các sản phẩm may mặc,OTC,3200000,https://finance.vietstock.vn/MKT-ctcp-det-minh-khai.htm
2489,MLG,CTCP Tập đoàn Mai Linh,Vận tải trung chuyển và vận tải hành khách bằng đường bộ,OTC,70716427,https://finance.vietstock.vn/MLG-ctcp-tap-doan-mai-linh.htm
2490,MLN,CTCP Mai Linh Miền Bắc,Vận tải trung chuyển và vận tải hành khách bằng đường bộ,Khác,48625332,https://finance.vietstock.vn/MLN-ctcp-mai-linh-mien-bac.htm
2491,MMC,CTCP khoáng Sản Mangan,Khai khoáng (ngoại trừ dầu mỏ và khí đốt),Khác,3160000,https://finance.vietstock.vn/MMC-ctcp-khoang-san-mangan.htm
2492,MNC,CTCP Mai Linh Miền Trung,Vận tải trung chuyển và vận tải hành khách bằng đường bộ,Khác,9279261,https://finance.vietstock.vn/MNC-ctcp-mai-linh-mien-trung.htm
2493,MobiFone,Tổng Công ty Viễn thông MobiFone - Công ty TNHH MTV,Viễn thông,Khác,0,https://finance.vietstock.vn/MobiFone-tong-cong-ty-vien-thong-mobifone-cong-ty-tnhh-mtv.htm
2494,MOBITECHS,CTCP Dịch vụ Kỹ thuật và Hạ tầng Mạng Thông Tin Di Động,Viễn thông,OTC,0,https://finance.vietstock.vn/MOBITECHS-ctcp-dich-vu-ky-thuat-va-ha-tang-mang-thong-tin-di-dong.htm
2495,MotorVN,CTCP United Motor Việt Nam,Sản xuất trang thiết bị nội thất và sản phẩm liên quan,OTC,37500000,https://finance.vietstock.vn/MotorVN-ctcp-united-motor-viet-nam.htm
2496,MSC,CTCP Dịch vụ Phú Nhuận,Bán buôn hàng tiêu dùng,OTC,22500000,https://finance.vietstock.vn/MSC-ctcp-dich-vu-phu-nhuan.htm
2497,MSGS,Công ty TNHH chứng khoán JB Việt Nam,"Môi giới chứng khoán, hàng hóa, đầu tư tài chính khác và các hoạt động liên quan",Khác,30000000,https://finance.vietstock.vn/MSGS-cong-ty-tnhh-chung-khoan-jb-viet-nam.htm
2498,MSI,CTCP Chứng khoán KB Việt Nam,"Môi giới chứng khoán, hàng hóa, đầu tư tài chính khác và các hoạt động liên quan",OTC,0,https://finance.vietstock.vn/MSI-ctcp-chung-khoan-kb-viet-nam.htm
2499,MTJ,CTCP Tư vấn và Xây dựng công trình Miền Trung,"Xây dựng nhà cửa, cao ốc",OTC,4500000,https://finance.vietstock.vn/MTJ-ctcp-tu-van-va-xay-dung-cong-trinh-mien-trung.htm
2500,MTM,CTCP mỏ và Xuất nhập khẩu Khoáng sản Miền Trung,Khai khoáng (ngoại trừ dầu mỏ và khí đốt),OTC,31000000,https://finance.vietstock.vn/MTM-ctcp-mo-va-xuat-nhap-khau-khoang-san-mien-trung.htm
2501,MVY,CTCP Môi trường và Dịch vụ Đô Thị Vĩnh Yên,Dịch vụ quản lý và tái chế chất thải,OTC,5969946,https://finance.vietstock.vn/MVY-ctcp-moi-truong-va-dich-vu-do-thi-vinh-yen.htm
2502,MXC,Trung tâm Nông nghiệp Mùa Xuân,Trồng rừng và khai thác gỗ,OTC,700938,https://finance.vietstock.vn/MXC-trung-tam-nong-nghiep-mua-xuan.htm
2503,MyKhe,CTCP Mỹ Khê Việt Nam,Khách sạn và phòng ở,OTC,0,https://finance.vietstock.vn/MyKhe-ctcp-my-khe-viet-nam.htm
2504,MyPhamSG,CTCP Mỹ phẩm Sài Gòn,Bán buôn hàng tiêu dùng,OTC,0,https://finance.vietstock.vn/MyPhamSG-ctcp-my-pham-sai-gon.htm
2505,Nakydaco,CTCP Dầu thực vật Tân Bình,Sản xuất thực phẩm,OTC,4310000,https://finance.vietstock.vn/Nakydaco-ctcp-dau-thuc-vat-tan-binh.htm
2506,NamChien,CTCP Thủy điện Nậm Chiến,Chăn nuôi,OTC,0,https://finance.vietstock.vn/NamChien-ctcp-thuy-dien-nam-chien.htm
2507,NAMCO,CTCP Khoáng sản Nghệ An,Khai khoáng (ngoại trừ dầu mỏ và khí đốt),OTC,0,https://finance.vietstock.vn/NAMCO-ctcp-khoang-san-nghe-an.htm
2508,NamKhang,CTCP Đầu tư Nam Khang,"Xây dựng nhà cửa, cao ốc",OTC,8300000,https://finance.vietstock.vn/NamKhang-ctcp-dau-tu-nam-khang.htm
2509,NamMuc,CTCP Thủy điện Nậm Mức,Chăn nuôi,OTC,0,https://finance.vietstock.vn/NamMuc-ctcp-thuy-dien-nam-muc.htm
2510,NamThi,CTCP Thủy điện Nậm Thi - Sông Đà 7,"Xây dựng nhà cửa, cao ốc",OTC,0,https://finance.vietstock.vn/NamThi-ctcp-thuy-dien-nam-thi-song-da-7.htm
2511,NamTrieu,CTCP Công nghiệp Tàu thủy và Xây dựng Nam Triệu,Sửa chữa và bảo trì,OTC,0,https://finance.vietstock.vn/NamTrieu-ctcp-cong-nghiep-tau-thuy-va-xay-dung-nam-trieu.htm
2512,NamVietOil,CTCP Lọc Hoá Dầu Nam Việt,Bán buôn hàng tiêu dùng,OTC,0,https://finance.vietstock.vn/NamVietOil-ctcp-loc-hoa-dau-nam-viet.htm
2513,Natraco,CTCP Thương mại Nghệ An,Bán lẻ xe hơi và phụ tùng,OTC,0,https://finance.vietstock.vn/Natraco-ctcp-thuong-mai-nghe-an.htm
2514,NBN,CTCP Xây dựng Công trình 545,"Xây dựng nhà cửa, cao ốc",OTC,0,https://finance.vietstock.vn/NBN-ctcp-xay-dung-cong-trinh-545.htm
2515,NBR,CTCP Đường sắt Nghĩa Bình,Hỗ trợ vận tải,OTC,1806000,https://finance.vietstock.vn/NBR-ctcp-duong-sat-nghia-binh.htm
2516,NBS,CTCP Bến xe Nghệ An,Hỗ trợ vận tải,OTC,3153200,https://finance.vietstock.vn/NBS-ctcp-ben-xe-nghe-an.htm
2517,NCG,CTCP Tập đoàn Nova Consumer,Hoạt động hỗ trợ cho nông lâm nghiệp,OTC,0,https://finance.vietstock.vn/NCG-ctcp-tap-doan-nova-consumer.htm
2518,NCP,CTCP Nhiệt điện Cẩm Phả - TKV,"Phát, truyền tải và phân phối điện năng",Khác,196980622,https://finance.vietstock.vn/NCP-ctcp-nhiet-dien-cam-pha-tkv.htm
2519,NEEM,CTCP Thiết bị Điện Miền Bắc,Chăn nuôi,OTC,0,https://finance.vietstock.vn/NEEM-ctcp-thiet-bi-dien-mien-bac.htm
2520,NgocHy,CTCP Dịch vụ In Trần Ngọc Hy Cà Mau,Dịch vụ quản lý và tái chế chất thải,OTC,0,https://finance.vietstock.vn/NgocHy-ctcp-dich-vu-in-tran-ngoc-hy-ca-mau.htm
2521,NgocTung,CTCP Sản xuất Thương mại Dịch vụ Ngọc Tùng,"Sản xuất hóa chất, dược phẩm",OTC,0,https://finance.vietstock.vn/NgocTung-ctcp-san-xuat-thuong-mai-dich-vu-ngoc-tung.htm
2522,NgoVietNam,CTCP Đầu tư Phát triển Ngô Việt Nam,Trồng trọt,OTC,0,https://finance.vietstock.vn/NgoVietNam-ctcp-dau-tu-phat-trien-ngo-viet-nam.htm
2523,NhaBeTech,CTCP Tư vấn Công nghệ Nhà Bè,Thiết kế hệ thống máy tính và dịch vụ liên quan,OTC,0,https://finance.vietstock.vn/NhaBeTech-ctcp-tu-van-cong-nghe-nha-be.htm
2524,NHACANTHO,Công ty TNHH MTV Phát triển và Kinh doanh Nhà Thành phố Cần Thơ,"Xây dựng nhà cửa, cao ốc",Khác,0,https://finance.vietstock.vn/NHACANTHO-cong-ty-tnhh-mtv-phat-trien-va-kinh-doanh-nha-thanh-pho-can-tho.htm
2525,NhanLuc,CTCP Phát triển Nguồn nhân lực LOD,Dịch vụ hành chính và hỗ trợ,OTC,0,https://finance.vietstock.vn/NhanLuc-ctcp-phat-trien-nguon-nhan-luc-lod.htm
2526,NhaSaiGon,CTCP Đầu tư Xây dựng và Kinh doanh Nhà Sài Gòn,Bất động sản,OTC,0,https://finance.vietstock.vn/NhaSaiGon-ctcp-dau-tu-xay-dung-va-kinh-doanh-nha-sai-gon.htm
2527,NhatMinhAudit,Công ty TNHH Kiểm toán Nhất Minh,Dịch vụ pháp lý,Khác,0,https://finance.vietstock.vn/NhatMinhAudit-cong-ty-tnhh-kiem-toan-nhat-minh.htm
2528,NhatNam,CTCP Nhất Nam,"Sản xuất các sản phẩm điện tử, vi tính",OTC,0,https://finance.vietstock.vn/NhatNam-ctcp-nhat-nam.htm
2529,NHDulieu,Công ty TNHH Ngân hàng Dữ liệu,Dịch vụ pháp lý,Khác,0,https://finance.vietstock.vn/NHDulieu-cong-ty-tnhh-ngan-hang-du-lieu.htm
2530,NhietDienMienBac,CTCP Dịch vụ Sửa chữa Nhiệt điện Miền Bắc,Sửa chữa và bảo trì,OTC,0,https://finance.vietstock.vn/NhietDienMienBac-ctcp-dich-vu-sua-chua-nhiet-dien-mien-bac.htm
2531,NHN,CTCP Phát triển Đô thị Nam Hà Nội,Bất động sản,OTC,200000000,https://finance.vietstock.vn/NHN-ctcp-phat-trien-do-thi-nam-ha-noi.htm
2532,NhoQue1,CTCP Thủy điện Nho Quế 1,"Phát, truyền tải và phân phối điện năng",OTC,0,https://finance.vietstock.vn/NhoQue1-ctcp-thuy-dien-nho-que-1.htm
2533,NHS,CTCP Đường Ninh Hòa,Sản xuất thực phẩm,OTC,60750000,https://finance.vietstock.vn/NHS-ctcp-duong-ninh-hoa.htm
2534,NhuNgoc,CTCP Sản xuất và Thương mại Xuất nhập khẩu Như Ngọc,Bán buôn hàng tiêu dùng,OTC,0,https://finance.vietstock.vn/NhuNgoc-ctcp-san-xuat-va-thuong-mai-xuat-nhap-khau-nhu-ngoc.htm
2535,NHW,CTCP Ngô Han,"Sản xuất các sản phẩm điện tử, vi tính",OTC,22950627,https://finance.vietstock.vn/NHW-ctcp-ngo-han.htm
2536,NIC,CTCP Đầu tư Nhơn Trạch,"Xây dựng nhà cửa, cao ốc",OTC,0,https://finance.vietstock.vn/NIC-ctcp-dau-tu-nhon-trach.htm
2537,Nicotex,CTCP Nicotex,"Sản xuất hóa chất, dược phẩm",Khác,0,https://finance.vietstock.vn/Nicotex-ctcp-nicotex.htm
2538,NinhBac,CTCP Đầu tư Tài chính Ninh Bắc,Bất động sản,OTC,0,https://finance.vietstock.vn/NinhBac-ctcp-dau-tu-tai-chinh-ninh-bac.htm
2539,NIS,CTCP Dịch vụ Hạ tầng Mạng,Viễn thông,OTC,3000000,https://finance.vietstock.vn/NIS-ctcp-dich-vu-ha-tang-mang.htm
2540,NISACO,CTCP Muối Ninh Thuận,Sản xuất thực phẩm,OTC,0,https://finance.vietstock.vn/NISACO-ctcp-muoi-ninh-thuan.htm
2541,NKD,CTCP Chế biến thực phẩm Kinh Đô Miền Bắc,Sản xuất thực phẩm,OTC,15124213,https://finance.vietstock.vn/NKD-ctcp-che´-bie´n-thuc-pham-kinh-do-mien-bac.htm
2542,NLC,CTCP Thủy điện Nà Lơi,"Phát, truyền tải và phân phối điện năng",OTC,5000000,https://finance.vietstock.vn/NLC-ctcp-thuy-dien-na-loi.htm
2543,NMK,CTCP Xây dựng Công trình 510,"Xây dựng nhà cửa, cao ốc",OTC,2700000,https://finance.vietstock.vn/NMK-ctcp-xay-dung-cong-trinh-510.htm
2544,NNB,CTCP Cấp thoát nước Ninh Bình,"Nước, chất thải và các hệ thống khác",OTC,15080000,https://finance.vietstock.vn/NNB-ctcp-cap-thoat-nuoc-ninh-binh.htm
2545,NNQ,CTCP Giống Nông nghiệp Quảng Nam,Hoạt động hỗ trợ cho nông lâm nghiệp,OTC,1281303,https://finance.vietstock.vn/NNQ-ctcp-giong-nong-nghiep-quang-nam.htm
2546,NO1,CTCP Tập đoàn 911,Bán buôn hàng lâu bền,OTC,24000000,https://finance.vietstock.vn/NO1-ctcp-tap-doan-911.htm
2547,NoiHoiVN,CTCP Nồi hơi Việt Nam,Sản xuất sản phẩm khoáng chất phi kim,OTC,0,https://finance.vietstock.vn/NoiHoiVN-ctcp-noi-hoi-viet-nam.htm
2548,NongSanNinhThuan,CTCP Xuất khẩu Nông sản Ninh Thuận,Sản xuất thực phẩm,OTC,0,https://finance.vietstock.vn/NongSanNinhThuan-ctcp-xuat-khau-nong-san-ninh-thuan.htm
2549,NPH,CTCP Khách Sạn Bưu Điện Nha Trang,Khách sạn và phòng ở,OTC,2000000,https://finance.vietstock.vn/NPH-ctcp-khach-san-buu-dien-nha-trang.htm
2550,NPS,CTCP May Phú Thịnh - Nhà Bè,Sản xuất các sản phẩm may mặc,OTC,2170000,https://finance.vietstock.vn/NPS-ctcp-may-phu-thinh-nha-be.htm
2551,NSCTech,CTCP Công nghệ NCS,"Xử lý dữ liệu, hosting và các dịch vụ liên quan",OTC,4000000,https://finance.vietstock.vn/NSCTech-ctcp-cong-nghe-ncs.htm
2552,NSI,CTCP Chứng khoán Quốc Gia,"Môi giới chứng khoán, hàng hóa, đầu tư tài chính khác và các hoạt động liên quan",OTC,5000000,https://finance.vietstock.vn/NSI-ctcp-chung-khoan-quoc-gia.htm
2553,NSN,CTCP Xây dựng 565,"Xây dựng nhà cửa, cao ốc",OTC,2959314,https://finance.vietstock.vn/NSN-ctcp-xay-dung-565.htm
2554,NSP,CTCP Nhựa Sam Phú,Sản xuất các sản phẩm nhựa và cao su,OTC,5000000,https://finance.vietstock.vn/NSP-ctcp-nhua-sam-phu.htm
2555,NTR,CTCP Đường sắt Nghệ Tĩnh,Hỗ trợ vận tải,OTC,1492000,https://finance.vietstock.vn/NTR-ctcp-duong-sat-nghe-tinh.htm
2556,NTS,CTCP Nội thất SHINEC,"Sản xuất các sản phẩm điện tử, vi tính",OTC,2000000,https://finance.vietstock.vn/NTS-ctcp-noi-that-shinec.htm
2557,Nuocdathuysan,CTCP Nước đá Thủy sản Kiên giang,Sản xuất thực phẩm,OTC,0,https://finance.vietstock.vn/Nuocdathuysan-ctcp-nuoc-da-thuy-san-kien-giang.htm
2558,NuocQuangNam,CTCP Cấp thoát nước Quảng Nam,Chăn nuôi,OTC,21600000,https://finance.vietstock.vn/NuocQuangNam-ctcp-cap-thoat-nuoc-quang-nam.htm
2559,NuocSachLaoCai,Công ty TNHH MTV Kinh doanh Nước sạch Lào Cai,"Nước, chất thải và các hệ thống khác",Khác,0,https://finance.vietstock.vn/NuocSachLaoCai-cong-ty-tnhh-mtv-kinh-doanh-nuoc-sach-lao-cai.htm
2560,Nutifood,CTCP Thực phẩm Dinh dưỡng Đồng Tâm,Sản xuất thực phẩm,OTC,0,https://finance.vietstock.vn/Nutifood-ctcp-thuc-pham-dinh-duong-dong-tam.htm
2561,NVC,CTCP Nam Vang,Bán buôn hàng lâu bền,OTC,16000000,https://finance.vietstock.vn/NVC-ctcp-nam-vang.htm
2562,NVN,CTCP Nhà Việt Nam,Bất động sản,OTC,10656800,https://finance.vietstock.vn/NVN-ctcp-nha-viet-nam.htm
2563,NVS,CTCP Chứng khoán Navibank,"Môi giới chứng khoán, hàng hóa, đầu tư tài chính khác và các hoạt động liên quan",OTC,3500000,https://finance.vietstock.vn/NVS-ctcp-chung-khoan-navibank.htm
2564,Oceanbank,Ngân hàng Thương mại TNHH MTV Đại Dương,Trung gian tín dụng và các hoạt động liên quan,Khác,0,https://finance.vietstock.vn/Oceanbank-ngan-hang-thuong-mai-tnhh-mtv-dai-duong.htm
2565,OLC,"CTCP Xây dựng, Dịch vụ và Hợp tác Lao động","Xây dựng nhà cửa, cao ốc",OTC,0,https://finance.vietstock.vn/OLC-ctcp-xay-dung-dich-vu-va-hop-tac-lao-dong.htm
2566,OMC,CTCP Quản lý Quỹ Đầu tư Lighthouse,"Quỹ, Quỹ tín thác và các công cụ tài chính khác",OTC,0,https://finance.vietstock.vn/OMC-ctcp-quan-ly-quy-dau-tu-lighthouse.htm
2567,ORC,CTCP Bán lẻ và Quản lý Bất động sản Đại Dương,Cửa hàng đồ nội thất và đồ dùng gia đình,OTC,0,https://finance.vietstock.vn/ORC-ctcp-ban-le-va-quan-ly-bat-dong-san-dai-duong.htm
2568,OSC,CTCP Chứng khoán Đại Tây Dương,"Môi giới chứng khoán, hàng hóa, đầu tư tài chính khác và các hoạt động liên quan",OTC,13500000,https://finance.vietstock.vn/OSC-ctcp-chung-khoan-dai-tay-duong.htm
2569,OSCVN,CTCP Du lịch Dịch vụ Dầu khí Việt Nam,Khách sạn và phòng ở,OTC,0,https://finance.vietstock.vn/OSCVN-ctcp-du-lich-dich-vu-dau-khi-viet-nam.htm
2570,Oseven,CTCP Oseven,"Sản xuất hóa chất, dược phẩm",OTC,111600000,https://finance.vietstock.vn/Oseven-ctcp-oseven.htm
2571,OTG,CTCP Otran Logistics,Kho bãi,OTC,0,https://finance.vietstock.vn/OTG-ctcp-otran-logistics.htm
2572,OtoTienGiang,CTCP Vận tải Ô Tô Tiền Giang,Hỗ trợ vận tải,OTC,0,https://finance.vietstock.vn/OtoTienGiang-ctcp-van-tai-o-to-tien-giang.htm
2573,PacificAudit,Công ty TNHH Kiểm toán Thái Bình Dương,Dịch vụ pháp lý,Khác,0,https://finance.vietstock.vn/PacificAudit-cong-ty-tnhh-kiem-toan-thai-binh-duong.htm
2574,PACKEXIM,CTCP Sản xuất và Xuất nhập khẩu Bao bì,Sản xuất các sản phẩm nhựa và cao su,OTC,0,https://finance.vietstock.vn/PACKEXIM-ctcp-san-xuat-va-xuat-nhap-khau-bao-bi.htm
2575,Packsimex,CTCP Xuất nhập khẩu Sản xuất Gia công và Bao bì,Bán buôn hàng tiêu dùng,OTC,0,https://finance.vietstock.vn/Packsimex-ctcp-xuat-nhap-khau-san-xuat-gia-cong-va-bao-bi.htm
2576,PACO,Công ty TNHH Dịch vụ Kiểm toán và Tư vấn Kế toán Bắc Đẩu,Dịch vụ pháp lý,Khác,0,https://finance.vietstock.vn/PACO-cong-ty-tnhh-dich-vu-kiem-toan-va-tu-van-ke-toan-bac-dau.htm
2577,PAMCO,CTCP Quản lý Quỹ Thái Bình Dương,"Quỹ, Quỹ tín thác và các công cụ tài chính khác",OTC,0,https://finance.vietstock.vn/PAMCO-ctcp-quan-ly-quy-thai-binh-duong.htm
2578,PBK,CTCP Điện lực Dầu khí Bắc Kạn,"Phát, truyền tải và phân phối điện năng",OTC,8642300,https://finance.vietstock.vn/PBK-ctcp-dien-luc-dau-khi-bac-kan.htm
2579,PDAC,Công ty TNHH Kiểm toán và Tư vấn Phan Dũng,Dịch vụ pháp lý,Khác,0,https://finance.vietstock.vn/PDAC-cong-ty-tnhh-kiem-toan-va-tu-van-phan-dung.htm
2580,PDT,CTCP Thương mại Dầu khí Đồng Tháp,Trạm xăng,OTC,773526,https://finance.vietstock.vn/PDT-ctcp-thuong-mai-dau-khi-dong-thap.htm
2581,PeaceTour,CTCP Du lịch Hòa Bình Việt Nam,Khách sạn và phòng ở,OTC,0,https://finance.vietstock.vn/PeaceTour-ctcp-du-lich-hoa-binh-viet-nam.htm
2582,PetroKienGiang,CTCP Xăng dầu Dầu khí Kiên Giang,Bán buôn hàng tiêu dùng,OTC,0,https://finance.vietstock.vn/PetroKienGiang-ctcp-xang-dau-dau-khi-kien-giang.htm
2583,PETROMAT,CTCP Vật tư Xăng dầu Petec,Cửa hàng đồ nội thất và đồ dùng gia đình,OTC,0,https://finance.vietstock.vn/PETROMAT-ctcp-vat-tu-xang-dau-petec.htm
2584,PETROMEKONG,CTCP Vận tải Dầu khí Mê Kông,Bán buôn hàng lâu bền,OTC,0,https://finance.vietstock.vn/PETROMEKONG-ctcp-van-tai-dau-khi-me-kong.htm
2585,PetroTrade,Công ty Thương mại Xăng dầu Lào,Phân phối khí đốt thiên nhiên,Lào,235000000,https://finance.vietstock.vn/PetroTrade-cong-ty-thuong-mai-xang-dau-lao.htm
2586,PetroVietnam,Tập đoàn Dầu khí Việt Nam,"Khai thác dầu mỏ, khí đốt",Khác,0,https://finance.vietstock.vn/PetroVietnam-tap-doan-dau-khi-viet-nam.htm
